<!-- 

     File: colorlookup.dtd
   Author: Peter Hollemans
     Date: 2004/05/17

  CoastWatch Software Library and Utilities
  Copyright (c) 2004 National Oceanic and Atmospheric Administration
  All rights reserved.

  Developed by: CoastWatch / OceanWatch
                Center for Satellite Applications and Research
                http://coastwatch.noaa.gov

  For conditions of distribution and use, see the accompanying
  license.txt file.

-->

<!ELEMENT colorlookup (color*)>
<!ELEMENT color EMPTY>
<!ATTLIST color name CDATA #REQUIRED>
<!ATTLIST color r CDATA #REQUIRED>
<!ATTLIST color g CDATA #REQUIRED>
<!ATTLIST color b CDATA #REQUIRED>
